{
	"$schema": "https://raw.githubusercontent.com/kristiankunc/svs-core/refs/heads/main/service_templates/schema.json",
	"args": [],
	"default_volumes": [
		{
			"container": "/app/data",
			"host": null
		}
	],
	"description": "A generic Python service.",
	"dockerfile": "FROM python:3.13-slim AS builder\n\nENV PYTHONDONTWRITEBYTECODE=1\nENV PYTHONUNBUFFERED=1\n\nWORKDIR /app\n\nCOPY requirements.txt .\n\nRUN apt-get update && apt-get install -y --no-install-recommends\n\nRUN pip install --upgrade pip \\\n    && pip install -r requirements.txt\n\nFROM python:3.13-slim\n\nENV PYTHONDONTWRITEBYTECODE=1\nENV PYTHONUNBUFFERED=1\n\nRUN groupadd -r appuser && useradd -r -g appuser appuser\n\nCOPY --from=builder /usr/local/lib/python3.13/site-packages/ /usr/local/lib/python3.13/site-packages/\nCOPY --from=builder /usr/local/bin/ /usr/local/bin/\n\nWORKDIR /app\nCOPY . .\n\nRUN mkdir -p /app && chmod -R 700 /app\n\nUSER appuser\n\nCMD [\"sh\", \"-c\", \"/usr/local/bin/python main.py\"]",
	"name": "python-generic",
	"start_cmd": "sh -c \"/usr/local/bin/python main.py\"",
	"type": "build"
}
